models/agents-a1/vllm/cache/torch_compile/torch_aot_compile/61bda05feca29378847c32f031efa5c8dba258f38b0176a06a3e99e41df8ca50/inductor_cache/triton/1/YYBPMOLLDLZNQCVKQ6WPOFBR6QTFHYNITMYATE6NYIKVX25Z4IBQ/chunk_scaled_dot_kkt_fwd_kernel.autotune.json
{"key": [16, 128, 64, true, "torch.float16", "torch.float32", "torch.float32", "torch.float32", "torch.int32", "torch.int32"], "configs_timings": [[{"kwargs": {"BK": 32}, "num_warps": 2, "num_ctas": 1, "num_stages": 2, "maxnreg": null, "pre_hook": null, "ir_override": null}, [0.010239999741315842, 0.010239999741315842, 0.010239999741315842]], [{"kwargs": {"BK": 32}, "num_warps": 2, "num_ctas": 1, "num_stages": 3, "maxnreg": null, "pre_hook": null, "ir_override": null}, [0.009216000325977802, 0.009216000325977802, 0.009216000325977802]], [{"kwargs": {"BK": 32}, "num_warps": 2, "num_ctas": 1, "num_stages": 4, "maxnreg": null, "pre_hook": null, "ir_override": null}, [0.009216000325977802, 0.009216000325977802, 0.010239999741315842]], [{"kwargs": {"BK": 32}, "num_warps": 4, "num_ctas": 1, "num_stages": 2, "maxnreg": null, "pre_hook": null, "ir_override": null}, [0.009216000325977802, 0.00825599953532219, 0.009216000325977802]], [{"kwargs": {"BK": 32}, "num_warps": 4, "num_ctas": 1, "num_stages": 3, "maxnreg": null, "pre_hook": null, "ir_override": null}, [0.008191999979317188, 0.0071680000983178616, 0.008191999979317188]], [{"kwargs": {"BK": 32}, "num_warps": 4, "num_ctas": 1, "num_stages": 4, "maxnreg": null, "pre_hook": null, "ir_override": null}, [0.008191999979317188, 0.0071680000983178616, 0.008191999979317188]], [{"kwargs": {"BK": 32}, "num_warps": 8, "num_ctas": 1, "num_stages": 2, "maxnreg": null, "pre_hook": null, "ir_override": null}, [0.008191999979317188, 0.008191999979317188, 0.008191999979317188]], [{"kwargs": {"BK": 32}, "num_warps": 8, "num_ctas": 1, "num_stages": 3, "maxnreg": null, "pre_hook": null, "ir_override": null}, [0.0071680000983178616, 0.0071680000983178616, 0.008191999979317188]], [{"kwargs": {"BK": 32}, "num_warps": 8, "num_ctas": 1, "num_stages": 4, "maxnreg": null, "pre_hook": null, "ir_override": null}, [0.00800000037997961, 0.0071680000983178616, 0.008191999979317188]], [{"kwargs": {"BK": 64}, "num_warps": 2, "num_ctas": 1, "num_stages": 2, "maxnreg": null, "pre_hook": null, "ir_override": null}, [0.009279999881982803, 0.009216000325977802, 0.010239999741315842]], [{"kwargs": {"BK": 64}, "num_warps": 2, "num_ctas": 1, "num_stages": 3, "maxnreg": null, "pre_hook": null, "ir_override": null}, [0.009312000125646591, 0.009216000325977802, 0.010239999741315842]], [{"kwargs": {"BK": 64}, "num_warps": 2, "num_ctas": 1, "num_stages": 4, "maxnreg": null, "pre_hook": null, "ir_override": null}, [0.010239999741315842, 0.009216000325977802, 0.010239999741315842]], [{"kwargs": {"BK": 64}, "num_warps": 4, "num_ctas": 1, "num_stages": 2, "maxnreg": null, "pre_hook": null, "ir_override": null}, [0.008191999979317188, 0.0072639998979866505, 0.008191999979317188]], [{"kwargs": {"BK": 64}, "num_warps": 4, "num_ctas": 1, "num_stages": 3, "maxnreg": null, "pre_hook": null, "ir_override": null}, [0.008191999979317188, 0.007360000163316727, 0.008191999979317188]], [{"kwargs": {"BK": 64}, "num_warps": 4, "num_ctas": 1, "num_stages": 4, "maxnreg": null, "pre_hook": null, "ir_override": null}, [0.008191999979317188, 0.007968000136315823, 0.008191999979317188]], [{"kwargs": {"BK": 64}, "num_warps": 8, "num_ctas": 1, "num_stages": 2, "maxnreg": null, "pre_hook": null, "ir_override": null}, [0.008191999979317188, 0.0080960001796484, 0.008191999979317188]], [{"kwargs": {"BK": 64}, "num_warps": 8, "num_ctas": 1, "num_stages": 3, "maxnreg": null, "pre_hook": null, "ir_override": null}, [0.008031999692320824, 0.0071680000983178616, 0.008191999979317188]], [{"kwargs": {"BK": 64}, "num_warps": 8, "num_ctas": 1, "num_stages": 4, "maxnreg": null, "pre_hook": null, "ir_override": null}, [0.008191999979317188, 0.0071680000983178616, 0.008191999979317188]], [{"kwargs": {"BK": 128}, "num_warps": 2, "num_ctas": 1, "num_stages": 2, "maxnreg": null, "pre_hook": null, "ir_override": null}, [0.009216000325977802, 0.009216000325977802, 0.009216000325977802]], [{"kwargs": {"BK": 128}, "num_warps": 2, "num_ctas": 1, "num_stages": 3, "maxnreg": null, "pre_hook": null, "ir_override": null}, [0.010239999741315842, 0.009216000325977802, 0.010239999741315842]], [{"kwargs": {"BK": 128}, "num_warps": 2, "num_ctas": 1, "num_stages": 4, "maxnreg": null, "pre_hook": null, "ir_override": null}, [0.010239999741315842, 0.009216000325977802, 0.010239999741315842]], [{"kwargs": {"BK": 128}, "num_warps": 4, "num_ctas": 1, "num_stages": 2, "maxnreg": null, "pre_hook": null, "ir_override": null}, [0.008191999979317188, 0.008191999979317188, 0.008198400028049946]], [{"kwargs": {"BK": 128}, "num_warps": 4, "num_ctas": 1, "num_stages": 3, "maxnreg": null, "pre_hook": null, "ir_override": null}, [0.008191999979317188, 0.008191999979317188, 0.009216000325977802]], [{"kwargs": {"BK": 128}, "num_warps": 4, "num_ctas": 1, "num_stages": 4, "maxnreg": null, "pre_hook": null, "ir_override": null}, [0.008191999979317188, 0.008191999979317188, 0.008191999979317188]], [{"kwargs": {"BK": 128}, "num_warps": 8, "num_ctas": 1, "num_stages": 2, "maxnreg": null, "pre_hook": null, "ir_override": null}, [0.008191999979317188, 0.0071680000983178616, 0.008191999979317188]], [{"kwargs": {"BK": 128}, "num_warps": 8, "num_ctas": 1, "num_stages": 3, "maxnreg": null, "pre_hook": null, "ir_override": null}, [0.008191999979317188, 0.0071680000983178616, 0.008191999979317188]], [{"kwargs": {"BK": 128}, "num_warps": 8, "num_ctas": 1, "num_stages": 4, "maxnreg": null, "pre_hook": null, "ir_override": null}, [0.008191999979317188, 0.0072639998979866505, 0.008191999979317188]]]}