models/agents-a1/vllm/cache/torch_compile/torch_aot_compile/61bda05feca29378847c32f031efa5c8dba258f38b0176a06a3e99e41df8ca50/inductor_cache/triton/0/BK6JBYQS5RREXFMKP3KV46UKWQ7J3X45PH44HSPGZZUTGKQ75FZQ/chunk_fwd_kernel_o.autotune.json
{"key": [16, 128, 128, 64, "torch.float16", "torch.float16", "torch.float16", "torch.float16", "torch.float32", "torch.float16", "torch.int32", "torch.int32"], "configs_timings": [[{"kwargs": {"BK": 32, "BV": 32}, "num_warps": 2, "num_ctas": 1, "num_stages": 2, "maxnreg": null, "pre_hook": null, "ir_override": null}, [0.01228800043463707, 0.011264000087976456, 0.01228800043463707]], [{"kwargs": {"BK": 32, "BV": 32}, "num_warps": 2, "num_ctas": 1, "num_stages": 3, "maxnreg": null, "pre_hook": null, "ir_override": null}, [0.009279999881982803, 0.009216000325977802, 0.010239999741315842]], [{"kwargs": {"BK": 32, "BV": 32}, "num_warps": 2, "num_ctas": 1, "num_stages": 4, "maxnreg": null, "pre_hook": null, "ir_override": null}, [0.010239999741315842, 0.009216000325977802, 0.010239999741315842]], [{"kwargs": {"BK": 32, "BV": 32}, "num_warps": 4, "num_ctas": 1, "num_stages": 2, "maxnreg": null, "pre_hook": null, "ir_override": null}, [0.009440000168979168, 0.009216000325977802, 0.010239999741315842]], [{"kwargs": {"BK": 32, "BV": 32}, "num_warps": 4, "num_ctas": 1, "num_stages": 3, "maxnreg": null, "pre_hook": null, "ir_override": null}, [0.009216000325977802, 0.00825599953532219, 0.009216000325977802]], [{"kwargs": {"BK": 32, "BV": 32}, "num_warps": 4, "num_ctas": 1, "num_stages": 4, "maxnreg": null, "pre_hook": null, "ir_override": null}, [0.009216000325977802, 0.009056000038981438, 0.009216000325977802]], [{"kwargs": {"BK": 32, "BV": 32}, "num_warps": 8, "num_ctas": 1, "num_stages": 2, "maxnreg": null, "pre_hook": null, "ir_override": null}, [0.011264000087976456, 0.011212799698114395, 0.011264000087976456]], [{"kwargs": {"BK": 32, "BV": 32}, "num_warps": 8, "num_ctas": 1, "num_stages": 3, "maxnreg": null, "pre_hook": null, "ir_override": null}, [0.010239999741315842, 0.010239999741315842, 0.011264000087976456]], [{"kwargs": {"BK": 32, "BV": 32}, "num_warps": 8, "num_ctas": 1, "num_stages": 4, "maxnreg": null, "pre_hook": null, "ir_override": null}, [0.010239999741315842, 0.010239999741315842, 0.011097599752247334]], [{"kwargs": {"BK": 32, "BV": 64}, "num_warps": 2, "num_ctas": 1, "num_stages": 2, "maxnreg": null, "pre_hook": null, "ir_override": null}, [0.013311999849975109, 0.013311999849975109, 0.013344000093638897]], [{"kwargs": {"BK": 32, "BV": 64}, "num_warps": 2, "num_ctas": 1, "num_stages": 3, "maxnreg": null, "pre_hook": null, "ir_override": null}, [0.01228800043463707, 0.01228800043463707, 0.013311999849975109]], [{"kwargs": {"BK": 32, "BV": 64}, "num_warps": 2, "num_ctas": 1, "num_stages": 4, "maxnreg": null, "pre_hook": null, "ir_override": null}, [0.013248000293970108, 0.01228800043463707, 0.013311999849975109]], [{"kwargs": {"BK": 32, "BV": 64}, "num_warps": 4, "num_ctas": 1, "num_stages": 2, "maxnreg": null, "pre_hook": null, "ir_override": null}, [0.011264000087976456, 0.01033599954098463, 0.011264000087976456]], [{"kwargs": {"BK": 32, "BV": 64}, "num_warps": 4, "num_ctas": 1, "num_stages": 3, "maxnreg": null, "pre_hook": null, "ir_override": null}, [0.010239999741315842, 0.009356800094246864, 0.010239999741315842]], [{"kwargs": {"BK": 32, "BV": 64}, "num_warps": 4, "num_ctas": 1, "num_stages": 4, "maxnreg": null, "pre_hook": null, "ir_override": null}, [0.010239999741315842, 0.010239999741315842, 0.010239999741315842]], [{"kwargs": {"BK": 32, "BV": 64}, "num_warps": 8, "num_ctas": 1, "num_stages": 2, "maxnreg": null, "pre_hook": null, "ir_override": null}, [0.013311999849975109, 0.013311999849975109, 0.014175999909639359]], [{"kwargs": {"BK": 32, "BV": 64}, "num_warps": 8, "num_ctas": 1, "num_stages": 3, "maxnreg": null, "pre_hook": null, "ir_override": null}, [0.01228800043463707, 0.01228800043463707, 0.01235199999064207]], [{"kwargs": {"BK": 32, "BV": 64}, "num_warps": 8, "num_ctas": 1, "num_stages": 4, "maxnreg": null, "pre_hook": null, "ir_override": null}, [0.012480000033974648, 0.01228800043463707, 0.013311999849975109]], [{"kwargs": {"BK": 64, "BV": 32}, "num_warps": 2, "num_ctas": 1, "num_stages": 2, "maxnreg": null, "pre_hook": null, "ir_override": null}, [0.011024000123143196, 0.010239999741315842, 0.011264000087976456]], [{"kwargs": {"BK": 64, "BV": 32}, "num_warps": 2, "num_ctas": 1, "num_stages": 3, "maxnreg": null, "pre_hook": null, "ir_override": null}, [0.010239999741315842, 0.010239999741315842, 0.011264000087976456]], [{"kwargs": {"BK": 64, "BV": 32}, "num_warps": 2, "num_ctas": 1, "num_stages": 4, "maxnreg": null, "pre_hook": null, "ir_override": null}, [0.010239999741315842, 0.010239999741315842, 0.011206400208175184]], [{"kwargs": {"BK": 64, "BV": 32}, "num_warps": 4, "num_ctas": 1, "num_stages": 2, "maxnreg": null, "pre_hook": null, "ir_override": null}, [0.010048000141978264, 0.009216000325977802, 0.010239999741315842]], [{"kwargs": {"BK": 64, "BV": 32}, "num_warps": 4, "num_ctas": 1, "num_stages": 3, "maxnreg": null, "pre_hook": null, "ir_override": null}, [0.009216000325977802, 0.009216000325977802, 0.009247999638319016]], [{"kwargs": {"BK": 64, "BV": 32}, "num_warps": 4, "num_ctas": 1, "num_stages": 4, "maxnreg": null, "pre_hook": null, "ir_override": null}, [0.009216000325977802, 0.009216000325977802, 0.009247999638319016]], [{"kwargs": {"BK": 64, "BV": 32}, "num_warps": 8, "num_ctas": 1, "num_stages": 2, "maxnreg": null, "pre_hook": null, "ir_override": null}, [0.011264000087976456, 0.011264000087976456, 0.012095999903976917]], [{"kwargs": {"BK": 64, "BV": 32}, "num_warps": 8, "num_ctas": 1, "num_stages": 3, "maxnreg": null, "pre_hook": null, "ir_override": null}, [0.011264000087976456, 0.011264000087976456, 0.011359999887645245]], [{"kwargs": {"BK": 64, "BV": 32}, "num_warps": 8, "num_ctas": 1, "num_stages": 4, "maxnreg": null, "pre_hook": null, "ir_override": null}, [0.011264000087976456, 0.011264000087976456, 0.01228800043463707]], [{"kwargs": {"BK": 64, "BV": 64}, "num_warps": 2, "num_ctas": 1, "num_stages": 2, "maxnreg": null, "pre_hook": null, "ir_override": null}, [0.013311999849975109, 0.013311999849975109, 0.014336000196635723]], [{"kwargs": {"BK": 64, "BV": 64}, "num_warps": 2, "num_ctas": 1, "num_stages": 3, "maxnreg": null, "pre_hook": null, "ir_override": null}, [0.014336000196635723, 0.013344000093638897, 0.014336000196635723]], [{"kwargs": {"BK": 64, "BV": 64}, "num_warps": 2, "num_ctas": 1, "num_stages": 4, "maxnreg": null, "pre_hook": null, "ir_override": null}, [0.015359999611973763, 0.014399999752640724, 0.015359999611973763]], [{"kwargs": {"BK": 64, "BV": 64}, "num_warps": 4, "num_ctas": 1, "num_stages": 2, "maxnreg": null, "pre_hook": null, "ir_override": null}, [0.011264000087976456, 0.010304000228643417, 0.011264000087976456]], [{"kwargs": {"BK": 64, "BV": 64}, "num_warps": 4, "num_ctas": 1, "num_stages": 3, "maxnreg": null, "pre_hook": null, "ir_override": null}, [0.011264000087976456, 0.010239999741315842, 0.011264000087976456]], [{"kwargs": {"BK": 64, "BV": 64}, "num_warps": 4, "num_ctas": 1, "num_stages": 4, "maxnreg": null, "pre_hook": null, "ir_override": null}, [0.011264000087976456, 0.010239999741315842, 0.011264000087976456]], [{"kwargs": {"BK": 64, "BV": 64}, "num_warps": 8, "num_ctas": 1, "num_stages": 2, "maxnreg": null, "pre_hook": null, "ir_override": null}, [0.01228800043463707, 0.01228800043463707, 0.013311999849975109]], [{"kwargs": {"BK": 64, "BV": 64}, "num_warps": 8, "num_ctas": 1, "num_stages": 3, "maxnreg": null, "pre_hook": null, "ir_override": null}, [0.012368000112473965, 0.01228800043463707, 0.013311999849975109]], [{"kwargs": {"BK": 64, "BV": 64}, "num_warps": 8, "num_ctas": 1, "num_stages": 4, "maxnreg": null, "pre_hook": null, "ir_override": null}, [0.01228800043463707, 0.01228800043463707, 0.013311999849975109]]]}