models/agents-a1/vllm/cache/torch_compile/torch_aot_compile/61bda05feca29378847c32f031efa5c8dba258f38b0176a06a3e99e41df8ca50/inductor_cache/triton/0/RMZREJPRM5FZUGYUAN5CLWYR2FZCJYK3Q7U72VNL3HZCDRA7XQ2Q/merge_16x16_to_64x64_inverse_kernel.autotune.json
{"key": [16, 64, true, "torch.float32", "torch.float16", "torch.int32", "torch.int32"], "configs_timings": [[{"kwargs": {}, "num_warps": 2, "num_ctas": 1, "num_stages": 2, "maxnreg": null, "pre_hook": null, "ir_override": null}, [0.018432000651955605, 0.018432000651955605, 0.018432000651955605]], [{"kwargs": {}, "num_warps": 2, "num_ctas": 1, "num_stages": 3, "maxnreg": null, "pre_hook": null, "ir_override": null}, [0.018432000651955605, 0.018432000651955605, 0.01945599913597107]], [{"kwargs": {}, "num_warps": 2, "num_ctas": 1, "num_stages": 4, "maxnreg": null, "pre_hook": null, "ir_override": null}, [0.020479999482631683, 0.020479999482631683, 0.020479999482631683]], [{"kwargs": {}, "num_warps": 2, "num_ctas": 1, "num_stages": 5, "maxnreg": null, "pre_hook": null, "ir_override": null}, [0.018432000651955605, 0.018432000651955605, 0.01945599913597107]], [{"kwargs": {}, "num_warps": 4, "num_ctas": 1, "num_stages": 2, "maxnreg": null, "pre_hook": null, "ir_override": null}, [0.018239999189972878, 0.01740800030529499, 0.018432000651955605]], [{"kwargs": {}, "num_warps": 4, "num_ctas": 1, "num_stages": 3, "maxnreg": null, "pre_hook": null, "ir_override": null}, [0.018432000651955605, 0.01740800030529499, 0.018432000651955605]], [{"kwargs": {}, "num_warps": 4, "num_ctas": 1, "num_stages": 4, "maxnreg": null, "pre_hook": null, "ir_override": null}, [0.01825599931180477, 0.01740800030529499, 0.018432000651955605]], [{"kwargs": {}, "num_warps": 4, "num_ctas": 1, "num_stages": 5, "maxnreg": null, "pre_hook": null, "ir_override": null}, [0.018432000651955605, 0.01740800030529499, 0.018432000651955605]], [{"kwargs": {}, "num_warps": 8, "num_ctas": 1, "num_stages": 2, "maxnreg": null, "pre_hook": null, "ir_override": null}, [0.01740800030529499, 0.01740800030529499, 0.01740800030529499]], [{"kwargs": {}, "num_warps": 8, "num_ctas": 1, "num_stages": 3, "maxnreg": null, "pre_hook": null, "ir_override": null}, [0.01740800030529499, 0.01740800030529499, 0.018432000651955605]], [{"kwargs": {}, "num_warps": 8, "num_ctas": 1, "num_stages": 4, "maxnreg": null, "pre_hook": null, "ir_override": null}, [0.01740800030529499, 0.01740800030529499, 0.01740800030529499]], [{"kwargs": {}, "num_warps": 8, "num_ctas": 1, "num_stages": 5, "maxnreg": null, "pre_hook": null, "ir_override": null}, [0.01740800030529499, 0.01740800030529499, 0.01740800030529499]]]}