models/agents-a1/vllm/cache/torch_compile/torch_aot_compile/61bda05feca29378847c32f031efa5c8dba258f38b0176a06a3e99e41df8ca50/inductor_cache/triton/0/IHTYXJOGEU664ESQ3XDWNPEL7YOM77PTLAA3GVYD4YYVFSFQO5SQ/chunk_local_cumsum_scalar_kernel.autotune.json
{"key": [1, 16, 64, true, false, "torch.float32", "torch.float32", "torch.int32", "torch.int32"], "configs_timings": [[{"kwargs": {}, "num_warps": 1, "num_ctas": 1, "num_stages": 3, "maxnreg": null, "pre_hook": null, "ir_override": null}, [0.004095999989658594, 0.004095999989658594, 0.005119999870657921]], [{"kwargs": {}, "num_warps": 2, "num_ctas": 1, "num_stages": 3, "maxnreg": null, "pre_hook": null, "ir_override": null}, [0.004095999989658594, 0.004095999989658594, 0.005119999870657921]], [{"kwargs": {}, "num_warps": 4, "num_ctas": 1, "num_stages": 3, "maxnreg": null, "pre_hook": null, "ir_override": null}, [0.004095999989658594, 0.004095999989658594, 0.004095999989658594]], [{"kwargs": {}, "num_warps": 8, "num_ctas": 1, "num_stages": 3, "maxnreg": null, "pre_hook": null, "ir_override": null}, [0.004095999989658594, 0.004095999989658594, 0.005119999870657921]]]}