models/agents-a1/vllm/cache/torch_compile/torch_aot_compile/61bda05feca29378847c32f031efa5c8dba258f38b0176a06a3e99e41df8ca50/inductor_cache/triton/1/CQBGML6YWDV2CVIDIQG5PETHHRZXAIRZH57IR4V46UGZG5NF345A/chunk_gated_delta_rule_fwd_kernel_h_blockdim64.autotune.json
{"key": [16, 128, 128, 64, "torch.float16", "torch.float16", "torch.float16", "torch.float16", "torch.float32", "torch.float16", "torch.float32", "torch.float32", "torch.int32", "torch.int64"], "configs_timings": [[{"kwargs": {"BV": 32}, "num_warps": 2, "num_ctas": 1, "num_stages": 2, "maxnreg": null, "pre_hook": null, "ir_override": null}, [0.010239999741315842, 0.010239999741315842, 0.011264000087976456]], [{"kwargs": {"BV": 64}, "num_warps": 2, "num_ctas": 1, "num_stages": 2, "maxnreg": null, "pre_hook": null, "ir_override": null}, [0.016383999958634377, 0.016383999958634377, 0.01724799908697605]], [{"kwargs": {"BV": 32}, "num_warps": 2, "num_ctas": 1, "num_stages": 3, "maxnreg": null, "pre_hook": null, "ir_override": null}, [0.011264000087976456, 0.010239999741315842, 0.011264000087976456]], [{"kwargs": {"BV": 64}, "num_warps": 2, "num_ctas": 1, "num_stages": 3, "maxnreg": null, "pre_hook": null, "ir_override": null}, [0.01945599913597107, 0.01945599913597107, 0.01945599913597107]], [{"kwargs": {"BV": 32}, "num_warps": 2, "num_ctas": 1, "num_stages": 4, "maxnreg": null, "pre_hook": null, "ir_override": null}, [Infinity, Infinity, Infinity]], [{"kwargs": {"BV": 64}, "num_warps": 2, "num_ctas": 1, "num_stages": 4, "maxnreg": null, "pre_hook": null, "ir_override": null}, [Infinity, Infinity, Infinity]], [{"kwargs": {"BV": 32}, "num_warps": 4, "num_ctas": 1, "num_stages": 2, "maxnreg": null, "pre_hook": null, "ir_override": null}, [0.009216000325977802, 0.009216000325977802, 0.010239999741315842]], [{"kwargs": {"BV": 64}, "num_warps": 4, "num_ctas": 1, "num_stages": 2, "maxnreg": null, "pre_hook": null, "ir_override": null}, [0.012095999903976917, 0.011264000087976456, 0.01228800043463707]], [{"kwargs": {"BV": 32}, "num_warps": 4, "num_ctas": 1, "num_stages": 3, "maxnreg": null, "pre_hook": null, "ir_override": null}, [0.009216000325977802, 0.009216000325977802, 0.009344000369310379]], [{"kwargs": {"BV": 64}, "num_warps": 4, "num_ctas": 1, "num_stages": 3, "maxnreg": null, "pre_hook": null, "ir_override": null}, [0.011264000087976456, 0.011264000087976456, 0.01208959985524416]], [{"kwargs": {"BV": 32}, "num_warps": 4, "num_ctas": 1, "num_stages": 4, "maxnreg": null, "pre_hook": null, "ir_override": null}, [Infinity, Infinity, Infinity]], [{"kwargs": {"BV": 64}, "num_warps": 4, "num_ctas": 1, "num_stages": 4, "maxnreg": null, "pre_hook": null, "ir_override": null}, [Infinity, Infinity, Infinity]]]}