models/agents-a1/vllm/cache/torch_compile/torch_aot_compile/61bda05feca29378847c32f031efa5c8dba258f38b0176a06a3e99e41df8ca50/inductor_cache/triton/1/BK6JBYQS5RREXFMKP3KV46UKWQ7J3X45PH44HSPGZZUTGKQ75FZQ/chunk_fwd_kernel_o.autotune.json
{"key": [16, 128, 128, 64, "torch.float16", "torch.float16", "torch.float16", "torch.float16", "torch.float32", "torch.float16", "torch.int32", "torch.int32"], "configs_timings": [[{"kwargs": {"BK": 32, "BV": 32}, "num_warps": 2, "num_ctas": 1, "num_stages": 2, "maxnreg": null, "pre_hook": null, "ir_override": null}, [0.011392000131309032, 0.011264000087976456, 0.01228800043463707]], [{"kwargs": {"BK": 32, "BV": 32}, "num_warps": 2, "num_ctas": 1, "num_stages": 3, "maxnreg": null, "pre_hook": null, "ir_override": null}, [0.010239999741315842, 0.010239999741315842, 0.01027199998497963]], [{"kwargs": {"BK": 32, "BV": 32}, "num_warps": 2, "num_ctas": 1, "num_stages": 4, "maxnreg": null, "pre_hook": null, "ir_override": null}, [0.010239999741315842, 0.01017600018531084, 0.010239999741315842]], [{"kwargs": {"BK": 32, "BV": 32}, "num_warps": 4, "num_ctas": 1, "num_stages": 2, "maxnreg": null, "pre_hook": null, "ir_override": null}, [0.010239999741315842, 0.009292799979448318, 0.010239999741315842]], [{"kwargs": {"BK": 32, "BV": 32}, "num_warps": 4, "num_ctas": 1, "num_stages": 3, "maxnreg": null, "pre_hook": null, "ir_override": null}, [0.009216000325977802, 0.009216000325977802, 0.009216000325977802]], [{"kwargs": {"BK": 32, "BV": 32}, "num_warps": 4, "num_ctas": 1, "num_stages": 4, "maxnreg": null, "pre_hook": null, "ir_override": null}, [0.009216000325977802, 0.009011199697852135, 0.009216000325977802]], [{"kwargs": {"BK": 32, "BV": 32}, "num_warps": 8, "num_ctas": 1, "num_stages": 2, "maxnreg": null, "pre_hook": null, "ir_override": null}, [0.011264000087976456, 0.011264000087976456, 0.01228800043463707]], [{"kwargs": {"BK": 32, "BV": 32}, "num_warps": 8, "num_ctas": 1, "num_stages": 3, "maxnreg": null, "pre_hook": null, "ir_override": null}, [0.01033599954098463, 0.010239999741315842, 0.011264000087976456]], [{"kwargs": {"BK": 32, "BV": 32}, "num_warps": 8, "num_ctas": 1, "num_stages": 4, "maxnreg": null, "pre_hook": null, "ir_override": null}, [0.010239999741315842, 0.010239999741315842, 0.011264000087976456]], [{"kwargs": {"BK": 32, "BV": 64}, "num_warps": 2, "num_ctas": 1, "num_stages": 2, "maxnreg": null, "pre_hook": null, "ir_override": null}, [0.013311999849975109, 0.013311999849975109, 0.013510400243103505]], [{"kwargs": {"BK": 32, "BV": 64}, "num_warps": 2, "num_ctas": 1, "num_stages": 3, "maxnreg": null, "pre_hook": null, "ir_override": null}, [0.01228800043463707, 0.01228800043463707, 0.012543999589979649]], [{"kwargs": {"BK": 32, "BV": 64}, "num_warps": 2, "num_ctas": 1, "num_stages": 4, "maxnreg": null, "pre_hook": null, "ir_override": null}, [0.012512000277638435, 0.01228800043463707, 0.013311999849975109]], [{"kwargs": {"BK": 32, "BV": 64}, "num_warps": 4, "num_ctas": 1, "num_stages": 2, "maxnreg": null, "pre_hook": null, "ir_override": null}, [0.01119999960064888, 0.010239999741315842, 0.011264000087976456]], [{"kwargs": {"BK": 32, "BV": 64}, "num_warps": 4, "num_ctas": 1, "num_stages": 3, "maxnreg": null, "pre_hook": null, "ir_override": null}, [0.010239999741315842, 0.010239999741315842, 0.010239999741315842]], [{"kwargs": {"BK": 32, "BV": 64}, "num_warps": 4, "num_ctas": 1, "num_stages": 4, "maxnreg": null, "pre_hook": null, "ir_override": null}, [0.010239999741315842, 0.010239999741315842, 0.011212799698114395]], [{"kwargs": {"BK": 32, "BV": 64}, "num_warps": 8, "num_ctas": 1, "num_stages": 2, "maxnreg": null, "pre_hook": null, "ir_override": null}, [0.013311999849975109, 0.013311999849975109, 0.014336000196635723]], [{"kwargs": {"BK": 32, "BV": 64}, "num_warps": 8, "num_ctas": 1, "num_stages": 3, "maxnreg": null, "pre_hook": null, "ir_override": null}, [0.013183999806642532, 0.01228800043463707, 0.013311999849975109]], [{"kwargs": {"BK": 32, "BV": 64}, "num_warps": 8, "num_ctas": 1, "num_stages": 4, "maxnreg": null, "pre_hook": null, "ir_override": null}, [0.012415999546647072, 0.01228800043463707, 0.013311999849975109]], [{"kwargs": {"BK": 64, "BV": 32}, "num_warps": 2, "num_ctas": 1, "num_stages": 2, "maxnreg": null, "pre_hook": null, "ir_override": null}, [0.011264000087976456, 0.011264000087976456, 0.011264000087976456]], [{"kwargs": {"BK": 64, "BV": 32}, "num_warps": 2, "num_ctas": 1, "num_stages": 3, "maxnreg": null, "pre_hook": null, "ir_override": null}, [0.010400000028312206, 0.010239999741315842, 0.011264000087976456]], [{"kwargs": {"BK": 64, "BV": 32}, "num_warps": 2, "num_ctas": 1, "num_stages": 4, "maxnreg": null, "pre_hook": null, "ir_override": null}, [0.011264000087976456, 0.010239999741315842, 0.011264000087976456]], [{"kwargs": {"BK": 64, "BV": 32}, "num_warps": 4, "num_ctas": 1, "num_stages": 2, "maxnreg": null, "pre_hook": null, "ir_override": null}, [0.010239999741315842, 0.009216000325977802, 0.010239999741315842]], [{"kwargs": {"BK": 64, "BV": 32}, "num_warps": 4, "num_ctas": 1, "num_stages": 3, "maxnreg": null, "pre_hook": null, "ir_override": null}, [0.009216000325977802, 0.009216000325977802, 0.010188800096511842]], [{"kwargs": {"BK": 64, "BV": 32}, "num_warps": 4, "num_ctas": 1, "num_stages": 4, "maxnreg": null, "pre_hook": null, "ir_override": null}, [0.009216000325977802, 0.009216000325977802, 0.009247999638319016]], [{"kwargs": {"BK": 64, "BV": 32}, "num_warps": 8, "num_ctas": 1, "num_stages": 2, "maxnreg": null, "pre_hook": null, "ir_override": null}, [0.011264000087976456, 0.011264000087976456, 0.011359999887645245]], [{"kwargs": {"BK": 64, "BV": 32}, "num_warps": 8, "num_ctas": 1, "num_stages": 3, "maxnreg": null, "pre_hook": null, "ir_override": null}, [0.012272000312805176, 0.011264000087976456, 0.01228800043463707]], [{"kwargs": {"BK": 64, "BV": 32}, "num_warps": 8, "num_ctas": 1, "num_stages": 4, "maxnreg": null, "pre_hook": null, "ir_override": null}, [0.01128000020980835, 0.011264000087976456, 0.01228800043463707]], [{"kwargs": {"BK": 64, "BV": 64}, "num_warps": 2, "num_ctas": 1, "num_stages": 2, "maxnreg": null, "pre_hook": null, "ir_override": null}, [0.013311999849975109, 0.013311999849975109, 0.014336000196635723]], [{"kwargs": {"BK": 64, "BV": 64}, "num_warps": 2, "num_ctas": 1, "num_stages": 3, "maxnreg": null, "pre_hook": null, "ir_override": null}, [0.014336000196635723, 0.014336000196635723, 0.014336000196635723]], [{"kwargs": {"BK": 64, "BV": 64}, "num_warps": 2, "num_ctas": 1, "num_stages": 4, "maxnreg": null, "pre_hook": null, "ir_override": null}, [0.014336000196635723, 0.014246399886906146, 0.014336000196635723]], [{"kwargs": {"BK": 64, "BV": 64}, "num_warps": 4, "num_ctas": 1, "num_stages": 2, "maxnreg": null, "pre_hook": null, "ir_override": null}, [0.011264000087976456, 0.010400000028312206, 0.011264000087976456]], [{"kwargs": {"BK": 64, "BV": 64}, "num_warps": 4, "num_ctas": 1, "num_stages": 3, "maxnreg": null, "pre_hook": null, "ir_override": null}, [0.011264000087976456, 0.011238399893045425, 0.011264000087976456]], [{"kwargs": {"BK": 64, "BV": 64}, "num_warps": 4, "num_ctas": 1, "num_stages": 4, "maxnreg": null, "pre_hook": null, "ir_override": null}, [0.011264000087976456, 0.010463999584317207, 0.011264000087976456]], [{"kwargs": {"BK": 64, "BV": 64}, "num_warps": 8, "num_ctas": 1, "num_stages": 2, "maxnreg": null, "pre_hook": null, "ir_override": null}, [0.01228800043463707, 0.01228800043463707, 0.013248000293970108]], [{"kwargs": {"BK": 64, "BV": 64}, "num_warps": 8, "num_ctas": 1, "num_stages": 3, "maxnreg": null, "pre_hook": null, "ir_override": null}, [0.013311999849975109, 0.01228800043463707, 0.013311999849975109]], [{"kwargs": {"BK": 64, "BV": 64}, "num_warps": 8, "num_ctas": 1, "num_stages": 4, "maxnreg": null, "pre_hook": null, "ir_override": null}, [0.013311999849975109, 0.01228800043463707, 0.013311999849975109]]]}